comment_id,comment_text,analysis_date,sentiment,sentiment_score
1,خدمة تأجير السيارات كانت ممتازة وسريعة جداً. تجربة رائعة!,2026-03-10 03:33:30,Positive,-0.35
2,السيارة كانت نظيفة ومريحة، لكن كان هناك تأخير بسيط في الاستلام.,2026-03-10 03:33:30,Neutral,-0.2
3,تجربة سيئة للغاية، السيارة كانت متسخة والموظفون غير متعاونين.,2026-03-10 03:33:30,Negative,0.34
4,السعر جيد ولكن السيارة كانت تحتاج إلى صيانة بسيطة.,2026-03-10 03:33:30,Positive,-0.47
5,لن أتعامل مع هذه الشركة مرة أخرى، خدمة عملاء فظيعة.,2026-03-10 03:33:30,Negative,-0.67
