comment_id,comment_text,analysis_date,sentiment,sentiment_score
1,خدمة تأجير السيارات كانت ممتازة وسريعة جداً. تجربة رائعة!,2026-02-26 03:42:09,Positive,-0.71
2,السيارة كانت نظيفة ومريحة، لكن كان هناك تأخير بسيط في الاستلام.,2026-02-26 03:42:09,Neutral,-0.14
3,تجربة سيئة للغاية، السيارة كانت متسخة والموظفون غير متعاونين.,2026-02-26 03:42:09,Negative,-0.93
4,السعر جيد ولكن السيارة كانت تحتاج إلى صيانة بسيطة.,2026-02-26 03:42:09,Positive,-0.13
5,لن أتعامل مع هذه الشركة مرة أخرى، خدمة عملاء فظيعة.,2026-02-26 03:42:09,Negative,0.86
