comment_id,comment_text,analysis_date,sentiment,sentiment_score
1,خدمة تأجير السيارات كانت ممتازة وسريعة جداً. تجربة رائعة!,2026-02-20 03:41:25,Positive,0.15
2,السيارة كانت نظيفة ومريحة، لكن كان هناك تأخير بسيط في الاستلام.,2026-02-20 03:41:25,Neutral,-0.74
3,تجربة سيئة للغاية، السيارة كانت متسخة والموظفون غير متعاونين.,2026-02-20 03:41:25,Negative,0.91
4,السعر جيد ولكن السيارة كانت تحتاج إلى صيانة بسيطة.,2026-02-20 03:41:25,Positive,-0.58
5,لن أتعامل مع هذه الشركة مرة أخرى، خدمة عملاء فظيعة.,2026-02-20 03:41:25,Negative,-0.41
