comment_id,comment_text,analysis_date,sentiment,sentiment_score
1,خدمة تأجير السيارات كانت ممتازة وسريعة جداً. تجربة رائعة!,2025-11-29 02:38:35,Positive,-0.74
2,السيارة كانت نظيفة ومريحة، لكن كان هناك تأخير بسيط في الاستلام.,2025-11-29 02:38:35,Neutral,0.53
3,تجربة سيئة للغاية، السيارة كانت متسخة والموظفون غير متعاونين.,2025-11-29 02:38:35,Negative,0.33
4,السعر جيد ولكن السيارة كانت تحتاج إلى صيانة بسيطة.,2025-11-29 02:38:35,Positive,0.18
5,لن أتعامل مع هذه الشركة مرة أخرى، خدمة عملاء فظيعة.,2025-11-29 02:38:35,Negative,-0.47
