comment_id,comment_text,analysis_date,sentiment,sentiment_score
1,خدمة تأجير السيارات كانت ممتازة وسريعة جداً. تجربة رائعة!,2026-01-29 03:32:53,Positive,0.51
2,السيارة كانت نظيفة ومريحة، لكن كان هناك تأخير بسيط في الاستلام.,2026-01-29 03:32:53,Neutral,-0.21
3,تجربة سيئة للغاية، السيارة كانت متسخة والموظفون غير متعاونين.,2026-01-29 03:32:53,Negative,0.03
4,السعر جيد ولكن السيارة كانت تحتاج إلى صيانة بسيطة.,2026-01-29 03:32:53,Positive,0.96
5,لن أتعامل مع هذه الشركة مرة أخرى، خدمة عملاء فظيعة.,2026-01-29 03:32:53,Negative,0.95
