comment_id,comment_text,analysis_date,sentiment,sentiment_score
1,خدمة تأجير السيارات كانت ممتازة وسريعة جداً. تجربة رائعة!,2025-07-07 02:56:04,Positive,0.39
2,السيارة كانت نظيفة ومريحة، لكن كان هناك تأخير بسيط في الاستلام.,2025-07-07 02:56:04,Neutral,-0.71
3,تجربة سيئة للغاية، السيارة كانت متسخة والموظفون غير متعاونين.,2025-07-07 02:56:04,Negative,0.39
4,السعر جيد ولكن السيارة كانت تحتاج إلى صيانة بسيطة.,2025-07-07 02:56:04,Positive,-0.79
5,لن أتعامل مع هذه الشركة مرة أخرى، خدمة عملاء فظيعة.,2025-07-07 02:56:04,Negative,0.94
