comment_id,comment_text,analysis_date,sentiment,sentiment_score
1,خدمة تأجير السيارات كانت ممتازة وسريعة جداً. تجربة رائعة!,2025-11-05 02:34:10,Positive,-0.73
2,السيارة كانت نظيفة ومريحة، لكن كان هناك تأخير بسيط في الاستلام.,2025-11-05 02:34:10,Neutral,0.35
3,تجربة سيئة للغاية، السيارة كانت متسخة والموظفون غير متعاونين.,2025-11-05 02:34:10,Negative,0.79
4,السعر جيد ولكن السيارة كانت تحتاج إلى صيانة بسيطة.,2025-11-05 02:34:10,Positive,0.88
5,لن أتعامل مع هذه الشركة مرة أخرى، خدمة عملاء فظيعة.,2025-11-05 02:34:10,Negative,0.54
