comment_id,comment_text,analysis_date,sentiment,sentiment_score
1,خدمة تأجير السيارات كانت ممتازة وسريعة جداً. تجربة رائعة!,2025-12-27 02:58:26,Positive,-0.2
2,السيارة كانت نظيفة ومريحة، لكن كان هناك تأخير بسيط في الاستلام.,2025-12-27 02:58:26,Neutral,-0.75
3,تجربة سيئة للغاية، السيارة كانت متسخة والموظفون غير متعاونين.,2025-12-27 02:58:26,Negative,-0.07
4,السعر جيد ولكن السيارة كانت تحتاج إلى صيانة بسيطة.,2025-12-27 02:58:26,Positive,-0.37
5,لن أتعامل مع هذه الشركة مرة أخرى، خدمة عملاء فظيعة.,2025-12-27 02:58:26,Negative,-0.03
