comment_id,comment_text,analysis_date,sentiment,sentiment_score
1,خدمة تأجير السيارات كانت ممتازة وسريعة جداً. تجربة رائعة!,2025-11-26 02:42:37,Positive,0.68
2,السيارة كانت نظيفة ومريحة، لكن كان هناك تأخير بسيط في الاستلام.,2025-11-26 02:42:37,Neutral,0.72
3,تجربة سيئة للغاية، السيارة كانت متسخة والموظفون غير متعاونين.,2025-11-26 02:42:37,Negative,0.02
4,السعر جيد ولكن السيارة كانت تحتاج إلى صيانة بسيطة.,2025-11-26 02:42:37,Positive,-0.04
5,لن أتعامل مع هذه الشركة مرة أخرى، خدمة عملاء فظيعة.,2025-11-26 02:42:37,Negative,-0.04
