comment_id,comment_text,analysis_date,sentiment,sentiment_score
1,خدمة تأجير السيارات كانت ممتازة وسريعة جداً. تجربة رائعة!,2025-10-25 02:25:44,Positive,0.25
2,السيارة كانت نظيفة ومريحة، لكن كان هناك تأخير بسيط في الاستلام.,2025-10-25 02:25:44,Neutral,0.31
3,تجربة سيئة للغاية، السيارة كانت متسخة والموظفون غير متعاونين.,2025-10-25 02:25:44,Negative,0.43
4,السعر جيد ولكن السيارة كانت تحتاج إلى صيانة بسيطة.,2025-10-25 02:25:44,Positive,-0.02
5,لن أتعامل مع هذه الشركة مرة أخرى، خدمة عملاء فظيعة.,2025-10-25 02:25:44,Negative,-0.81
