comment_id,comment_text,analysis_date,sentiment,sentiment_score
1,خدمة تأجير السيارات كانت ممتازة وسريعة جداً. تجربة رائعة!,2025-09-16 02:22:15,Positive,0.38
2,السيارة كانت نظيفة ومريحة، لكن كان هناك تأخير بسيط في الاستلام.,2025-09-16 02:22:15,Neutral,0.61
3,تجربة سيئة للغاية، السيارة كانت متسخة والموظفون غير متعاونين.,2025-09-16 02:22:15,Negative,-0.57
4,السعر جيد ولكن السيارة كانت تحتاج إلى صيانة بسيطة.,2025-09-16 02:22:15,Positive,-0.33
5,لن أتعامل مع هذه الشركة مرة أخرى، خدمة عملاء فظيعة.,2025-09-16 02:22:15,Negative,0.68
