comment_id,comment_text,analysis_date,sentiment,sentiment_score
1,خدمة تأجير السيارات كانت ممتازة وسريعة جداً. تجربة رائعة!,2025-12-25 03:02:45,Positive,0.27
2,السيارة كانت نظيفة ومريحة، لكن كان هناك تأخير بسيط في الاستلام.,2025-12-25 03:02:45,Neutral,-0.76
3,تجربة سيئة للغاية، السيارة كانت متسخة والموظفون غير متعاونين.,2025-12-25 03:02:45,Negative,0.34
4,السعر جيد ولكن السيارة كانت تحتاج إلى صيانة بسيطة.,2025-12-25 03:02:45,Positive,-0.48
5,لن أتعامل مع هذه الشركة مرة أخرى، خدمة عملاء فظيعة.,2025-12-25 03:02:45,Negative,0.14
