comment_id,comment_text,analysis_date,sentiment,sentiment_score
1,خدمة تأجير السيارات كانت ممتازة وسريعة جداً. تجربة رائعة!,2025-12-01 03:16:30,Positive,0.83
2,السيارة كانت نظيفة ومريحة، لكن كان هناك تأخير بسيط في الاستلام.,2025-12-01 03:16:30,Neutral,0.26
3,تجربة سيئة للغاية، السيارة كانت متسخة والموظفون غير متعاونين.,2025-12-01 03:16:30,Negative,0.95
4,السعر جيد ولكن السيارة كانت تحتاج إلى صيانة بسيطة.,2025-12-01 03:16:30,Positive,0.14
5,لن أتعامل مع هذه الشركة مرة أخرى، خدمة عملاء فظيعة.,2025-12-01 03:16:30,Negative,0.03
