comment_id,comment_text,analysis_date,sentiment,sentiment_score
1,خدمة تأجير السيارات كانت ممتازة وسريعة جداً. تجربة رائعة!,2025-08-20 02:32:13,Positive,0.11
2,السيارة كانت نظيفة ومريحة، لكن كان هناك تأخير بسيط في الاستلام.,2025-08-20 02:32:13,Neutral,-0.04
3,تجربة سيئة للغاية، السيارة كانت متسخة والموظفون غير متعاونين.,2025-08-20 02:32:13,Negative,0.69
4,السعر جيد ولكن السيارة كانت تحتاج إلى صيانة بسيطة.,2025-08-20 02:32:13,Positive,-0.92
5,لن أتعامل مع هذه الشركة مرة أخرى، خدمة عملاء فظيعة.,2025-08-20 02:32:13,Negative,0.97
