comment_id,comment_text,analysis_date,sentiment,sentiment_score
1,خدمة تأجير السيارات كانت ممتازة وسريعة جداً. تجربة رائعة!,2026-03-01 03:51:10,Positive,0.86
2,السيارة كانت نظيفة ومريحة، لكن كان هناك تأخير بسيط في الاستلام.,2026-03-01 03:51:10,Neutral,-0.11
3,تجربة سيئة للغاية، السيارة كانت متسخة والموظفون غير متعاونين.,2026-03-01 03:51:10,Negative,-0.87
4,السعر جيد ولكن السيارة كانت تحتاج إلى صيانة بسيطة.,2026-03-01 03:51:10,Positive,0.57
5,لن أتعامل مع هذه الشركة مرة أخرى، خدمة عملاء فظيعة.,2026-03-01 03:51:10,Negative,0.12
