comment_id,comment_text,analysis_date,sentiment,sentiment_score
1,خدمة تأجير السيارات كانت ممتازة وسريعة جداً. تجربة رائعة!,2026-01-07 03:05:52,Positive,-0.7
2,السيارة كانت نظيفة ومريحة، لكن كان هناك تأخير بسيط في الاستلام.,2026-01-07 03:05:52,Neutral,-0.39
3,تجربة سيئة للغاية، السيارة كانت متسخة والموظفون غير متعاونين.,2026-01-07 03:05:52,Negative,0.14
4,السعر جيد ولكن السيارة كانت تحتاج إلى صيانة بسيطة.,2026-01-07 03:05:52,Positive,-0.72
5,لن أتعامل مع هذه الشركة مرة أخرى، خدمة عملاء فظيعة.,2026-01-07 03:05:52,Negative,0.27
