comment_id,comment_text,analysis_date,sentiment,sentiment_score
1,خدمة تأجير السيارات كانت ممتازة وسريعة جداً. تجربة رائعة!,2025-10-23 02:28:02,Positive,0.12
2,السيارة كانت نظيفة ومريحة، لكن كان هناك تأخير بسيط في الاستلام.,2025-10-23 02:28:02,Neutral,-0.85
3,تجربة سيئة للغاية، السيارة كانت متسخة والموظفون غير متعاونين.,2025-10-23 02:28:02,Negative,-0.6
4,السعر جيد ولكن السيارة كانت تحتاج إلى صيانة بسيطة.,2025-10-23 02:28:02,Positive,0.95
5,لن أتعامل مع هذه الشركة مرة أخرى، خدمة عملاء فظيعة.,2025-10-23 02:28:02,Negative,0.78
