comment_id,comment_text,analysis_date,sentiment,sentiment_score
1,خدمة تأجير السيارات كانت ممتازة وسريعة جداً. تجربة رائعة!,2025-12-09 02:44:24,Positive,0.88
2,السيارة كانت نظيفة ومريحة، لكن كان هناك تأخير بسيط في الاستلام.,2025-12-09 02:44:24,Neutral,-0.84
3,تجربة سيئة للغاية، السيارة كانت متسخة والموظفون غير متعاونين.,2025-12-09 02:44:24,Negative,0.47
4,السعر جيد ولكن السيارة كانت تحتاج إلى صيانة بسيطة.,2025-12-09 02:44:24,Positive,-0.33
5,لن أتعامل مع هذه الشركة مرة أخرى، خدمة عملاء فظيعة.,2025-12-09 02:44:24,Negative,0.42
