comment_id,comment_text,analysis_date,sentiment,sentiment_score
1,خدمة تأجير السيارات كانت ممتازة وسريعة جداً. تجربة رائعة!,2025-06-30 11:06:20,Positive,-0.26
2,السيارة كانت نظيفة ومريحة، لكن كان هناك تأخير بسيط في الاستلام.,2025-06-30 11:06:20,Neutral,-0.05
3,تجربة سيئة للغاية، السيارة كانت متسخة والموظفون غير متعاونين.,2025-06-30 11:06:20,Negative,0.56
4,السعر جيد ولكن السيارة كانت تحتاج إلى صيانة بسيطة.,2025-06-30 11:06:20,Positive,0.81
5,لن أتعامل مع هذه الشركة مرة أخرى، خدمة عملاء فظيعة.,2025-06-30 11:06:20,Negative,0.64
